"Timestamp","Username","W kilku zdaniach opisz swoje ogólne odczucia, jakie emocje odczuwałeś/aś. Czy jedna z emocji - strach, smutek, obrzydzenie, złość - dobrze opisuje twoje doświadczenie? ","Opisz moment lub momenty, które były dla ciebie najważniejsze w tym doświadczeniu. ","Opisz, jak zmieniały się twoje odczucia na przestrzeni rozgrywki. ","Wskaż jeden lub kilka kluczowych elementów i/lub mechanik gry. W jaki sposób wpływały one na twoje doświadczenie? ","Jaki, twoim zdaniem, wpływ na rozgrywkę miała wirtualna rzeczywistość? "," Opisz krótko swoje wcześniejsze doświadczenia z wirtualną rzeczywistością. "
"2025/01/15 8:53:40 PM GMT+1","*****","Złość i agresję ","Jak mi słońce świeci w twarz, mam światłowstręt ","Na początku okay im dalej w las tym większe zdenerwowanie ","Kruki - złość, słońce - złość ten kij też łatwy nie był ","Bez VR się nie da","30-40h głównie w sportowych i zręcznościowych "
"2025/01/15 8:54:52 PM GMT+1","*****","Złość, bo nie wiem co się działo","Była trudna, bo w balansowaniu przeszkadzały kruki a potem było coraz mniej widać bo słońce raziło","Na początku byłam zainteresowana, ale na koniec mnie zdenerwowała bo prawie wypełniłam pasek postępu a przegralam","Kruki bardzo utrudniały grę tak samo jak słońce które zmniejszało widoczność ","Była to kluczową mechanika gry","Raz grałam w beat saber"
"2025/01/15 9:08:11 PM GMT+1","*****","Złość, gry nie udało mi się dokończyć z niewiadomych mi powodów, dodatkowo miałem wrażenie że pasek zapełniał się wolniej przy końcówce.","Moment w którym przegrałem grę był zdecydowanie kluczowym momentem i szczytem negatywnych emocji.","Początek był neutralny, wraz z końcówką gry czułem złość.","Nieregularna prędkość zapełniania paska negatywnie wpłynęła na moje doświadczenia","Rozgrywka była bardziej ummersyjna aczkolwiek nie zmienia to faktu iż była denerwująca ","Miałem wcześniejsze doświadczenie ale sporadyczne."
"2025/01/16 1:19:18 AM GMT+1","*****","niepewność, gra wymuszała stałe bycie czujnym ","nieoczekiwanie przegrano, mimo wrażenia bycia blisko zwycięstwa ","gra była angażująca, ale odgłosy wron stawały się irytujące ","Podobał mi się wpływ wron na rozgrywkę ","Gra była bardziej angażująca ","udzielono odpowiedzi w poprzedniej ankiecie "
"2025/01/16 1:19:36 AM GMT+1","*****","Podczas gry towarzyszyła mi wola walki, jednak ciągłe przegrywanie wywołało złość. Otoczenie, początkowo wywołujące ciekawość, okazało się utrudniać rozgrywkę wprowadzając dodatkową frustrację. ","W tym doświadczeniu najważniejsze były momenty przegranej, które wzmagały złość ale jednocześnie wolę walki.","Początkowo rozgrywka wydawała się prosta i przyjemna. Wraz z czasem wzrastała trudność oraz frustracja. Pomimo bycia blisko wygranej, nigdy się to nie udało, co wzmagało złość.","Pasek nie zapełniał się liniowo, co sprawiło trudność w estymacji czasu trwania rozgrywki i skutkowało większą frustracją.","Wirtualna rzeczywistość dodała grze whmiarowosci i wymagało od gracza większych umiejętności manualnych niż gra na PC.","Kilka krótkich gier podczas spotkań towarzyskich "
"2025/01/16 1:40:25 AM GMT+1","*****","Oswajanie się z „obecnością” w wirtualnej rzeczywistości. Kontrola nad ciałem, która była utrudniona przez założone gogle. Na początku miałam problem z utrzymaniem równowagi.","Nabycie kontroli nad ciałem w wirtualnej rzeczywistości ","Drastycznie, skupienie rosło, z każdym drgnięciem mija coraz bardziej starałam się kontrolować drganie reki","Latające ptaki powodujące ruchy kija, oślepiające slonce","Ciekawsze niż rodzaj takich gier za pomocą myszki","brak"